date_of_extract,organisation_number,registered_charity_number,linked_charity_number,charity_name,charity_type,charity_registration_status,date_of_registration,date_of_removal,charity_reporting_status,latest_acc_fin_period_start_date,latest_acc_fin_period_end_date,latest_income,latest_expenditure,charity_contact_address1,charity_contact_address2,charity_contact_address3,charity_contact_address4,charity_contact_address5,charity_contact_postcode,charity_contact_phone,charity_contact_email,charity_contact_web,charity_company_registration_number,charity_insolvent,charity_in_administration,charity_previously_excepted,charity_is_cdf_or_cif,charity_is_cio,cio_is_dissolved,date_cio_dissolution_notice,charity_activities,charity_gift_aid,charity_has_land
2026-04-24,5005315,1132260,0,THE PAROCHIAL CHURCH COUNCIL OF THE ECCLESIASTICAL PARISH OF ROCHESTER,Previously excepted,Registered,2009-10-22,,Submission Received Late,2024-01-01,2024-12-31,257084.0,100710.0,St. Peters Church Parish Centre,Delce Road,ROCHESTER,,,ME1 2EH,01634848900,office@parishofrochester.org.uk,www.parishofrochester.org.uk,,false,false,true,,false,false,,"Regular public worship open to all.  Pastoral work, visiting the sick and bereaved.  Teaching Christianity.  Taking of religious assemblies in schools.  The provision of youth activities with a Christian ethos.  Promotion of Christianity.  Promoting the whole mission of the church.  Provision of activities for senior citizens, parents and special need groups.  Supporting other charities.",true,true
2026-04-24,5005578,1132588,0,"THE PAROCHIAL CHURCH COUNCIL OF THE ECCLESIASTICAL PARISH OF ST MARY MAGDALENE, GILLINGHAM, ROCHESTER DIOCESE",Previously excepted,Registered,2009-11-07,,Submission Overdue,2023-01-01,2023-12-31,22124.0,55329.0,27 Gillingham Green,GILLINGHAM,Kent,,,ME7 1SS,01634 321546,gillinghamparishchurch@gmail.com,www.achurchnearyou.org/stmarymagdalene,,false,false,true,,false,false,,To enable ordinary people to live out their faith as part of our parish community through:- Provision of regular and varied services- Provision of opportunities for spiritual growth and discussion - Reaching out into the wider community- Ensuring St Mary Magdalene Church is financial viable- Maintaining and building ecumenical partnerships- Complying with Health and Safety Standards,true,true
2026-04-24,5005696,1132296,0,ST MARY'S CATHOLIC PRIMARY SCHOOL PTA,Other,Registered,2009-10-23,,Submission Double Default,2020-09-01,2021-08-31,614.0,1920.0,St. Marys Catholic Primary School,Greenfield Road,GILLINGHAM,Kent,,ME7 1YH,07901752297,heala062@stmarysrcp.medway.sch.uk,,,false,false,false,,false,false,,"St Mary's Catholic Primary School PTA - Various fundraising events including Christmas Bazaar, Summer Fayre, Summer School Disco, Raffles and various Tag Days throughout the year",false,false
2026-04-24,5005854,1132173,0,"THE PAROCHIAL CHURCH COUNCIL OF THE ECCLESIASTICAL PARISH OF ST JUSTUS, ROCHESTER",Previously excepted,Registered,2009-10-16,,Submission Received,2024-01-01,2024-12-31,74765.0,72608.0,ST. JUSTUS CHURCH,THE FAIRWAY,ROCHESTER,,,ME1 2LT,01634818353,office@stjustus.org,www.stjustus.org,,false,false,true,,false,false,,"Regular public worship open to all. The provision of sacred space for personal prayer and contemplation. Pastoral work, including visiting the sick and the bereaved. Teaching of Christianity through sermons, courses and small groups.  Promotion of Christianity through the staging of events and meetings. Promoting the whole mission of the church.  Supporting activities within the local community.",true,true
2026-04-24,5006070,1134849,0,"THE PAROCHIAL CHURCH COUNCIL OF THE ECCLESIASTICAL PARISH OF ST MARGARET OF ANTIOCH, RAINHAM, KENT",Previously excepted,Registered,2010-03-11,,Submission Received,2024-01-01,2024-12-31,163660.0,144163.0,St. Margarets Millennium Centre,Gatekeeper Chase,Rainham,GILLINGHAM,Kent,ME8 9BH,01634362023,office@rainhamchurch.co.uk,www.rainhamchurch.co.uk,,false,false,true,,false,false,,"Promoting in the ecclesiastical parish the whole mission of the church: pastoral, evangelistic, social and ecumenical. The PCC's responsibilities include the financial management of the parish, the care and maintenance of the church fabric, the churchyard and property directly owned by the PCC.",true,true
2026-04-24,5006822,1134084,0,"THE PAROCHIAL CHURCH COUNCIL OF THE ECCLESIASTICAL PARISH OF ST STEPHEN, CHATHAM",Previously excepted,Registered,2010-02-04,,Submission Received,2024-01-01,2024-12-31,111928.0,104770.0,PARISH CHURCH OF ST. STEPHEN,MAIDSTONE ROAD,CHATHAM,,,ME4 6JE,01634952622,ststephenchatham@hotmail.com,www.ststephenchatham.org.uk,,false,false,true,,false,false,,"Regular public worship open to all. The provision of sacred space for personal prayer and contemplation. Pastoral work, including visiting the sick and bereaved. Teaching of Christianity through sermons, courses and small groups. Taking of religioius assemblies in school. The provision of a youth group with Christian ethos.Promotion of Christianity through the staging of events and meetings.",true,false
2026-04-24,5007115,1133469,0,TWYDALL EVANGELICAL CHURCH,Previously excepted,Registered,2010-01-06,,Submission Received,2024-04-01,2025-03-31,25715.0,27342.0,33 HOATH LANE,GILLINGHAM,,,,ME8 0SW,01634233739,SECRETARY@TWYDALLEC.ORG.UK,www.twydallec.org.uk,,false,false,true,,false,false,,"Operation of a Christian church within the Twydall community of Gillingham, with outreaches to the community and with links to Christian charities and organisations in the Medway Towns and further afield.",true,true
2026-04-24,5007179,1133220,0,17TH GILLINGHAM (ST. MARGARET'S) SCOUT GROUP,Other,Registered,2009-12-10,,Submission Received,2024-04-01,2025-03-31,5622.0,3983.0,THE SCOUT HUT,The Howard School,Derwent Way,GILLINGHAM,,ME8 0BX,01634375748,17th@gillinghamscouts.org.uk,17thgillinghamscouts.org.uk,,false,false,false,,false,false,,"The purpose of Scouting is to contribute to the development of young people in achieving their full physical, intellectual, social and spiritual potentials, as individuals, as responsible citizens and as members of their local, national and international communities.",true,true
2026-04-24,5008010,1135029,0,MEDWAY VINEYARD CHURCH,CIO,Registered,2010-03-18,,Submission Received,2024-02-01,2025-01-31,64417.0,81411.0,15 Thames Avenue,Gillingham,,,,ME8 9BN,07966672612,medwayvineyard@gmail.com,www.medwayvineyard.org,,false,false,false,,true,false,,(a) to advance the Christian faith and the planting of other Vineyard churches;(b) to further Christian education;(c) to relieve sickness and financial hardship and to promote and preservegood health;(d) to provide or assist in the provision of facilities in the interests of socialwelfare for recreation or other leisure time occupation of individuals whohave need of such facilities.,true,false
2026-04-24,5008308,1135416,0,HOLY TRINITY SOUTH CHATHAM,Previously excepted,Registered,2010-04-09,,Submission Received,2024-01-01,2024-12-31,173011.0,196804.0,Holy Trinity South Chatham,St. Williams Church,Walderslade Village,CHATHAM,Kent,ME5 9LR,01634862265,DAVID.KICHENSIDE@GMAIL.COM,http://www.achurchnearyou.com/Holy-Trinity-South-Chatham,,false,false,true,,false,false,,"The churches of the charity celebrate public worship; teach the Christian faith; engage with the local community through mission, evangelism and social outreach; pastoral care including visiting the sick and bereaved; and the provision of facilities with a Christian ethos for the local community.",true,false
2026-04-24,5008442,1136444,0,NEW TESTAMENT CHRISTIAN MISSION INTERNATIONAL,Trust,Registered,2010-06-18,,Submission Received,2024-06-01,2025-05-31,44573.0,24771.0,18 Mariners View,GILLINGHAM,,,,ME7 2RW,07903991170,ntcmlondon@yahoo.co.uk,,,false,false,false,,false,false,,"Advance the Christian faith in Kent, the UK and the World in line with our statements of beliefs.Relieve persons in conditions of need or hardship, the aged and the sick in various parts of the UK or the World.Promote and fulfil such other charitable purposes beneficial to the community as the trustees may from time to time think fit.",true,false
2026-04-24,5009455,1141080,0,STAGE THEATRE SOCIETY,Other,Registered,2011-04-01,,Submission Received,2024-06-01,2025-05-31,26981.0,31102.0,9 Maritime Court,Dock Road,Chatham,,,ME4 4FH,07834516605,daniel@stagetheatresociety.co.uk,www.stagetheatresociety.co.uk,,false,false,false,,false,false,,Stage Theatre Society is a youth voluntary theatre group based in the Medway Towns. We produce performances with young people aged 7-19.,false,false
2026-04-24,5011072,1137826,0,HOPE ALIVE TRUST,Charitable company,Registered,2010-09-06,,Submission Received,2024-06-01,2025-05-31,70245.0,68346.0,PO BOX 456,CHATHAM,,,,ME5 8WL,08432891940,accountsandinfo@hopealivetrust.org,www.hopealivetrust.org,07262714,false,false,false,,false,false,,Medical missionary and mission trips. Set-up and equip orphanages.Construct water bore-holes for communities which lack clean water. Setting up and equipping basic health clinics for communities.Giving to meet individual's dire needs. Providing teaching sessions. And other means by which God shall enable us.,false,true
2026-04-24,5011212,1138948,0,"THE PAROCHIAL CHURCH COUNCIL OF THE ECCLESIASTICAL PARISH OF ST NICHOLAS WITH ST MARY, STROOD",Previously excepted,Registered,2010-11-11,,Submission Received,2024-01-01,2024-12-31,127114.0,175212.0,St Nicholas Church,High Street,Strood,Rochester,Kent,ME2 4TR ,01634715964,stnicholasstrood@gmail.com,www.saint-nicholaschurchstrood.btck.co.uk,,false,false,true,,false,false,,"We are a Anglican Church which provides regular public worship that is open to all. Our Pastoral work includes visiting the sick and the bereaved. We teach teach Christianity through sermons, comfirmation courses and small groups. We have a close connection with the local schools aand occasionly take assemblies. We support various charities with their work in the uk and overseas.",true,true
2026-04-24,5012795,1138126,0,REDEEMED CHRISTIAN CHURCH OF GOD (RCCG) PEACE AND LOVE ASSEMBLY,Trust,Registered,2010-09-20,,Submission Received,2023-09-01,2024-08-31,9861.0,15128.0,32 Stour Close,Rochester,,,,ME2 3JX,01634786496,peaceandloveassembly@gmail.com,,,false,false,false,,false,false,,The advancement of the Christian Faith Worldwide in accordance with the doctrines set out in the statement of faith.The relief of poverty through by giving to the less privilege in the society at large,false,true
2026-04-24,5013610,1139911,0,KICC NATIONAL FORUM - UK,Charitable company,Registered,2011-01-19,,Submission Received,2023-11-01,2024-10-31,109812.0,111135.0,KICC PRAYER CITY,BUCKMORE PARK,MAIDSTONE ROAD,CHATHAM,KENT,ME5 9QG ,02085250000,forum@kicc.org.uk,www.kicc.org.uk,07400723,false,false,false,,false,false,,"The advancement of the Christian Religion; and,the furtherance of the charitable work of the Charity by the advancement of such other charitable purposes as the Trustees shall from time to time decide.",false,false
2026-04-24,5015928,1140824,0,HOPE FOR PAKISTAN,Other,Registered,2011-03-17,,Submission Received,2024-08-01,2025-07-31,68725.0,64744.0,232 Bredhurst Road,GILLINGHAM,Kent,,,ME8 0RG,07840065558,info@hopeforpakistan.net,www.hopeforpakistan.net,,false,false,false,,false,false,,"Working to alleviate poverty and suffering by providing medical, humanitarian and financial assistance to the needy.",true,false
2026-04-24,5015959,1140957,0,CHARLES DICKENS CENTRE (GAD'S HILL) LIMITED,Charitable company,Registered,2011-03-17,,Submission Received,2023-09-01,2024-08-31,1944.0,672.0,Gad's Hill School,Gads Hill Place,"Gravesend Road,Higham",ROCHESTER,Kent,ME3 7PA,01474822366,information@gadshillplace.com,www.gadshillplace.com,07391645,false,false,false,,false,false,,"To raise funds to conserve and restore Gad's Hill Place to reflect how it was at the time Charles Dickens owned and lived here.  To open Gad's Hill Place as a museum for the general public, and impart information to about the life of Charles Dickens.  To commerate memorable events in Charles Dickens life at Gad's Hill Place.  To work with Gravesham and Medway council in promoting Charles Dickens",false,false
2026-04-24,5016022,1141384,0,MEDWAY STREET PASTORS,Other,Registered,2011-04-01,,Submission Received,2024-10-01,2025-09-30,603.0,1004.0,THE VINES UNITED REFORMED CHURCH,THE TERRACE,ROCHESTER,,,ME1 1XN,07811020075,medway@streetpastors.org.uk,www.streetpastors.co.uk,,false,false,false,,false,false,,To advance the Christian faith and to releive sickness and financial hardship.,false,false
2026-04-24,5016735,1141709,0,"THE PAROCHIAL CHURCH COUNCIL OF THE ECCLESIASTICAL PARISH OF ST MARK, GILLINGHAM",Previously excepted,Registered,2011-05-04,,Submission Received,2024-01-01,2024-12-31,339641.0,422469.0,98 Rainham Road,CHATHAM,,,,ME5 7EL,01634855792,vickyalle@gmail.com,www.stmarksgillingham.org,,false,false,true,,false,false,,"The operation and management of two Anglican Churches within the Parish, this includes the operation of a church sponsored Pre-school.",true,false
2026-04-24,5017796,1142272,0,SUSSEX CLUBS FOR YOUNG PEOPLE LIMITED,Charitable company,Registered,2011-06-06,,Suppressed,2021-04-01,2022-03-31,730529.0,631026.0,KRESTON REEVES,MONTAGUE PLACE,QUAYSIDE,CHATHAM MARITIME,CHATHAM,ME4 4QU, 01634899813, AMBER.MAPLEY@KRESTONREEVES.COM,HTTPS://WWW.KRESTONREEVES.COM,06938548,false,true,false,,false,false,,"We are an umbrella organisation for youth organisations in East and West Sussex and Brighton & Hove.  Established for over 80 years, we are committed to developing a vibrant grassroots led voluntary and community youth sector, which involves, empowers and meets the needs of young people in Sussex. We currently support 148 member organisations and directly deliver 43 weekly youth activities.",false,true
2026-04-24,5018379,1143354,0,KENT PENTECOSTAL CHURCH,Other,Registered,2011-08-15,,Submission Received,2023-08-16,2024-08-15,97507.0,59920.0,38 Rochester Crescent,Hoo,Rochester,,,ME3 9JH,01634789456,kentchurch07@gmail.com,,,false,false,false,,false,false,,Spreading Gospel around world.,false,true
2026-04-24,5018470,1146446,0,CET-C FOR WOMEN,Charitable company,Registered,2012-03-19,,Submission Received,2024-04-01,2025-03-31,47947.0,52695.0,13 Knights Templar Way,ROCHESTER,,,,ME2 2ZE,01634305996,info@cet-c4women.com,www.cet-c4women.co.uk,06290483,false,false,false,,false,false,,"CET-c for Women, based in London is serving England and Wales, and as required, extends services to other nations by activities  including: 1. Mission outreaches in advancing the Christian faith2. Promoting the understanding of marital harmony and parenting skills3. Educating the public in personal and collective family financial management 4. Promoting family health and social investment",true,false
2026-04-24,5022481,1146485,0,MEDWAY WATERSPORTS TRUST LIMITED,Charitable company,Registered,2012-03-21,,Submission Received,2024-04-01,2025-03-31,33440.0,30632.0,Medway Watersports Trust Ltd,Strand Approach Road,GILLINGHAM,,,ME7 1TT,01634582100,sails@medwaywatersports.co.uk,www.medwaywaterpsorts.co.uk,07222523,false,false,false,,false,false,,"Provision of water sports, including sailing, canoeing and kayaking and other outdoor activities for the local community, and especially schools and youth organisations, through access to the River Medway at The Strand, Gillingham, Kent.",true,false
2026-04-24,5022946,1144612,0,LIFE CONNECTION CENTRE,Trust,Registered,2011-11-10,,Submission Received,2023-11-01,2024-10-31,11998.0,10658.0,23A,Carpenters Close,Rochester,,,ME1 2QH,07817370730,info@theincorruptibleword.org.uk,www.theincorruptibleword.org.uk,05580803,false,false,false,,false,false,,"We encourage individuals to aspire in all areas of their lives through seminars provided free.We support and encourage family unionWe hold couples Dinner once a year for married couples (Annually).Village / Town Conferences.We hold seminars, conferences and conventions (Annually and Bi-monthly. As the need arises), for men, women (married or single)., youths and teens, widows as well.",false,false
2026-04-24,5023004,1144347,0,TAKE HEART MERCY MISSION,Charitable company,Registered,2011-10-19,,Submission Received Late,2024-06-01,2025-05-31,53294.0,44448.0,Gillingham Football Club,Priestfield Stadium,Priestfield Road,Gillingham,,ME7 4DD,01634300000,dwood@priestfield.com,http://www.takeheartmercymission.com/,07808704,false,false,false,,false,false,,"The Charity was developed and launched by its three trustees Gillingham FC Chairman Paul Scally, The Evelina Children?s Hospital?s Paediatric Heart Surgeon Dr Conal Austin and Paediatric Cardiology Consultant Dr John Simpson in 2012The newly formed charity encompasses the work of Mercy Mission which was started in 2001, and acquired charity status in 2005.",true,false
2026-04-24,5023918,1146450,0,LIFE NEUMA CHURCH,Other,Registered,2017-11-06,,Submission Received,2024-01-08,2025-01-07,1000.0,983.0,86 High Street,CHATHAM,Kent,,,ME4 4DS,0204-5292626,,,,false,false,false,,false,false,,"GENERAL ACTIVITIES  PURPOSES ? EDUCATION / TRAINING ? THE ADVANCEMENT OF HEALTH OR SAVING OF LIVES ? THE PREVENTION OR RELIEF OF POVERTY ? OVERSEAS AID / FAMINE RELIEF ? ACCOMMODATION / HOUSING ? CULTURAL ACTIVITIES, ARTS / CULTURE  &  SOCIAL EDUCATION/ HERITAGE / SCIENCE ? ECONOMIC / COMMUNITY DEVELOPMENT / EMPLOYMENT ? HUMAN RIGHTS / RACIAL HARMONY / EQUALITY OR DIVE",false,false
2026-04-24,5024616,1145540,0,MEDWAY CARES,Charitable company,Registered,2012-01-19,,Submission Received,2024-04-01,2025-03-31,16486.0,15286.0,M C H House,Bailey Drive,Gillingham Business Park,Gillingham,,ME8 0PZ,01634337593,louise.parker4@nhs.net,,07807784,false,false,false,,false,false,,"The charity was set up to- promote and protect the physical and mental health of the public through financial assistance, support, education and practical advice;-  relieve poverty and other need, in particular by reason of youth, age, ill health, disability, financial hardship or other disadvantage.Since its inception the charity has operated as a grant making body.",true,false
2026-04-24,5024687,1145356,0,THE REDEEMED CHRISTIAN CHURCH OF GOD ARK OF GOD PARISH,Trust,Registered,2012-01-10,,Submission Received,2023-07-01,2024-06-30,46560.0,48111.0,53 Harold Avenue,GILLINGHAM,Kent,,,ME7 2JH,07533196162,admin@rccgarkofgod.co.uk,https://www.rccgarkofgod.co.uk,,false,false,false,,false,false,,1. The advancement of the Christian faith worldwide in accordance with the doctrines set out in the Statement of Faith contained in the Schedule2. The relief of poverty,true,false
2026-04-24,5024688,1145835,0,RCCG COVENANT PRAISE CENTRE,Charitable company,Registered,2012-02-09,,Submission Received,2023-08-01,2024-07-31,6770.0,5992.0,Avenue Business Centre,17 New Road Avenue,CHATHAM,,,ME4 6BA,01634406094,admin@rccgcpc.co.uk,www.rccgcpc.co.uk,07722396,false,false,false,,false,false,,Organizing weekly activities to teach members the Christian life style and ensuring constant follow up occurs to build up the charity,true,false
2026-04-24,5025724,1146132,0,THE REDEEMED CHRISTIAN CHURCH OF GOD - PRAISE CITY,Trust,Registered,2012-02-28,,Submission Received,2024-01-01,2024-12-31,108436.0,110568.0,36 Louisville Avenue,GILLINGHAM,Kent,,,ME7 4EJ,07886860811,FINANCE@RCCGPRAISECITY.COM,www.rccgpraisecity.com,,false,false,false,,false,false,,The principal objectives of the charity as set out in the Declaration of Trust are the advancement of the Christian faith worldwide and the relief of poverty.This was achieved by making donations to RCCG Head Quarters for the World wide Evangelicalmission and Festival Of Life. Donations were also made to support other charities and christian events.,true,false
2026-04-24,5028708,1149886,0,St Joseph's Convent Secondary School Ex Pupil's Association,Other,Registered,2012-11-23,,Submission Received Late,2023-07-01,2024-06-30,46978.0,31776.0,71 Sycamore Road,ROCHESTER,Kent,,,ME2 2PH,07960746622,sjss_uk@yahoo.co.uk,http://sjssexpupilsuk.co.uk/,,false,false,false,,false,false,,"The charity supports a secondary school in Sierra Leone, that provides education for girls. The charity is made up of ex pupils of the school and this is one way of giving back.We have provided books, essential tables and chairs, replaced toilets and rewired buildings as examples. Currently, we are raising funds to re-roof a main building and construct extra classrooms.",false,false
2026-04-24,5028739,1147328,0,CORNERSTONE CITY CHURCH,Charitable company,Registered,2012-05-18,,Submission Received,2024-01-01,2024-12-31,513687.0,512701.0,THE JASPER CENTRE,JASPER AVENUE,ROCHESTER,KENT,,ME1 2LD,01634322878,office@cornerstonecity.co.uk,www.cornerstonecity.co.uk,07963955,false,false,false,,false,false,,"Medway Family Church Trust is a Christian Charity. Primary activities are Sunday worship,evangelism, children's teaching groups, work in the community including mother and toddlersgroups, fellowship groups, elderly persons meeting group, youth group, marriageencouragement courses and others as noted in the Annual Report.",true,true
2026-04-24,5029897,1149195,0,BEULAH CHRISTIAN FELLOWSHIP,Charitable company,Registered,2012-10-03,,Submission Received,2024-03-01,2025-02-28,8022.0,6665.0,Beulah Christian Fellowship,204 Napier Road,GILLINGHAM,,,ME7 4HL ,01634856850,beulahcf@btconnect.com,www.beulahcf.org.uk,08128851,false,false,false,,false,false,,We are a small independent Pentecostal Church whose main focus is the worship of and learning about our Lord and Saviour Jesus Christ as we seek to develop as Christians both individually and corporately as a congregation.,true,true
2026-04-24,5030434,1148899,0,KICC THE LIGHTHOUSE,Charitable company,Registered,2012-09-10,,Submission Received,2023-08-01,2024-07-31,64257.0,42647.0,KICC PRAYER CITY,BUCKMORE PARK,MAIDSTONE ROAD,CHATHAM,KENT,ME5 9QG ,02085250000,admin@KICC.org.uk,www.kicc.org.uk,08140761,false,false,false,,false,false,,Advancement of the Christian religion.  The furtherance of the charitable work of the charity by the advancement of such other charitable purposes as the Trustees shall from time to time decide.,false,false
2026-04-24,5030718,1150716,0,FOUNDATIONS: SUPPORTING FAMILIES,Charitable company,Registered,2013-02-06,,Submission Received,2023-09-01,2024-08-31,219906.0,175580.0,Foundations Supporting Families,18 New Road Avenue,CHATHAM,Kent,,ME4 6BA,01634829558,reception@foundationskent.uk,www.foundationskent.uk,08174051,false,false,false,,false,false,,We support families through separation and divorce to reduce trauma that this can have on them and children involved. We offer a number of services supported and supervised contact (where there is a risk). Support groups for adults and children to assist them in moving forward positively. We also support children and families maintain or renew contact when they are separated through adoption.,false,true
2026-04-24,5030860,1149070,0,GILLINGHAM WINTER SPORTS CLUB,Charitable company,Registered,2012-09-24,,Submission Double Default,2020-07-01,2021-12-31,489840.0,490068.0,The Ice Bowl,Ambley Road,Gillingham Business Park,Gillingham,,ME8 0PU,01634388477,gillingham@wintersports.org.uk,,07718838,false,false,false,,false,false,,"Activities  includes programmes in the following areas; schools, disability, amateur sport, health, social inclusion, women and girls and volunteer programmes. Programmes, consist of three core activities - education, suitable physical activity and social inclusion.",false,false
2026-04-24,5031165,1149373,0,"REDEEMED CHRISTIAN CHURCH OF GOD, CITY OF DAVID NEW CROSS",Trust,Registered,2012-10-18,,Submission Received,2023-11-01,2024-10-31,20000.0,18521.0,24 Mark Street,Chatham,,,,ME4 5PF,07737239064,cityofdavidnewcross@yahoo.co.uk,,,false,false,false,,false,false,,PREACHING THE GOSPEL OF JESUS CHRIST AND RELIEVE OF POVERTY,false,false
2026-04-24,5031715,1149127,0,TRINITY BAPTIST CHURCH DALSTON,Trust,Registered,2012-09-27,,Submission Received Late,2024-05-01,2025-04-30,24810.0,23707.0,33A Flat 1,Luton High Street,Chatham,,Kent,ME5 7LE,07415115861,,,,false,false,false,,false,false,,"Advancement of Christian Religion through Church Services, Seminars, Media and other related events.",false,false
2026-04-24,5032002,1155857,0,WISDOM HOSPICE SUPPORT,Charitable company,Registered,2014-02-19,,Submission Received,2024-04-01,2025-03-31,671776.0,618456.0,Medway P C T,Wisdom Hospice,High Bank,Rochester,,ME1 2NU,01634831163,info@fowh.org.uk,,08130595,false,false,false,,false,false,,The relief of sickness by the provision of funds to support the hospice care provided by The Friends of the Wisdom Hospice Limited,true,true
2026-04-24,5032261,1149618,0,BREDHURST WOODLAND ACTION GROUP,Charitable company,Registered,2012-11-05,,Submission Received,2024-04-01,2025-03-31,5254.0,7165.0,ENGLEFIELD,DUNN STREET ROAD,BREDHURST,GILLINGHAM,,ME7 3LY,01634372695,,www.bwag.org.uk,08253717,false,false,false,,false,false,,"Woodland management and conservation of Bredhurst Hurst, Kent",true,true
2026-04-24,5032470,1150625,0,INSTITUTE OF DEMOLITION ENGINEERS,Charitable company,Registered,2013-01-30,,Submission Received,2024-05-01,2025-04-30,189384.0,199324.0,Institute of Demolition Engineers,Office 2 Innovation Studios Medway,1044 Canal Road,Rochester,Kent,ME2 4DT,01634790548,info@ide.org.uk,www.ide.org.uk,08087902,false,false,false,,false,false,,The Institute of Demolition Engineers (IDE) exists to promote and foster the science of demolition engineering.The main objectives include the:Promotion of use of more efficient techniques in the industry;Encouragement of safer methods of working;Provision of a qualifying body for the industry.,false,true
