date_of_extract,organisation_number,registered_charity_number,linked_charity_number,charity_name,charity_type,charity_registration_status,date_of_registration,date_of_removal,charity_reporting_status,latest_acc_fin_period_start_date,latest_acc_fin_period_end_date,latest_income,latest_expenditure,charity_contact_address1,charity_contact_address2,charity_contact_address3,charity_contact_address4,charity_contact_address5,charity_contact_postcode,charity_contact_phone,charity_contact_email,charity_contact_web,charity_company_registration_number,charity_insolvent,charity_in_administration,charity_previously_excepted,charity_is_cdf_or_cif,charity_is_cio,cio_is_dissolved,date_cio_dissolution_notice,charity_activities,charity_gift_aid,charity_has_land
2026-04-24,5076140,1167351,0,THE NET COMMUNITY HUB,CIO,Registered,2016-05-25,,Submission Received,2024-04-01,2025-03-31,7979.0,24087.0,70 Silverweed Road,Walderslade,Chatham,,Kent,ME5 0QX ,01634319633,community@waldersladehub.org,www.waldersladehub.org,,false,false,false,,true,false,,"A community space to bring together elderly and isolated people in the community by running a number of activities each week, including a coffee morning, Time to Talk, Chairobics and arts & crafts.",false,false
2026-04-24,5078759,1167454,0,41ST MEDWAY TOWNS SCOUT GROUP,Other,Registered,2016-06-03,,Submission Received Late,2024-04-06,2025-04-05,48310.0,39920.0,9 Longwood,Walderslade,Chatham,,,ME5 9JG,07759 059870,41stmedwaygsl@gmail.com,,,false,false,false,,false,false,,"Scouting exists to actively engage and support young people in their personal development, empowering them to make a positive contribution to society. As Scouts we are guided by these values: Integrity - We act with integrity; we are honest, trustworthy and loyal. Respect - We have self-respect and respect for others.",false,true
2026-04-24,5079151,1169430,0,FIVE GRACE CHURCH,Charitable company,Registered,2016-09-30,,Submission Received,2023-12-01,2024-11-30,74203.0,76825.0,116 Maidstone Road,GUTU,CHATHAM,Kent,,ME4 6DQ,01634403797,hello@5grace.com,WWW.5GRACE.COM,09892495,false,false,false,,false,false,,"THE PRINCIPAL OBJECTIVES OF FIVE GRACE CHURCH, AS SET IN OUR CONSTITUTION, IS THE ADVANCEMENT OF THE CHRISTIAN FAITH FOR THE BENEFIT OF THE PUBLIC.",true,false
2026-04-24,5080625,1172256,0,LAWTECH TRUST,Charitable company,Registered,2017-03-24,,Submission Received,2024-04-01,2025-03-31,0.0,0.0,Lawtech Group Ltd,Unit 8 Ambley Green,Gillingham Business Park,GILLINGHAM,Kent,ME8 0NJ,01634290500,,,09967110,false,false,false,,false,false,,The prevention or relief of poverty in economically disadvantaged communities in England and Wales by making grants to provide services and facilities to such communities and by any other means for the public benefit according to the law of England and Wales as the charity trustees shall in their absolute discretion determine,false,false
2026-04-24,5080693,1171239,0,BUCKMORE PARK SCOUT CAMPSITE,CIO,Registered,2017-01-23,,Submission Received,2024-04-01,2025-03-31,35513.0,23635.0,Buckmore Park Scout Campsite,Maidstone Road,CHATHAM,,,ME5 9QG,01634 753522,enquiries@buckmorepark.org.uk,www.buckmorepark.org.uk,,false,false,false,,true,false,,"Buckmore Park Scout Campsite offers camping and activities for Youth Organisations in 142 acres of woodland just off the M20/A2 in Kent. It provides space for camps both large and small. A range of activities including air rifles, caving, orienteering and archery can be provided onsite with a wide range of other activities possible in the woodland.",true,true
2026-04-24,5080756,1170179,0,ALL SAINTS COMMUNITY PROJECT TRUST,CIO,Registered,2016-11-15,,Submission Received,2024-01-01,2024-12-31,209177.0,153898.0,33 MAGPIE HALL ROAD,CHATHAM,,,,ME4 5NE,01634845419,office@allsaintscommunityproject.org.uk,www.allsaintscommunityproject.co.uk,,false,false,false,,true,false,,"The All Saints Community Project operates a community Cafe at the Community Centre and also provides a community space for information and advice, training, a computer centre, access to Food bank, English language classes, lunch club, children's activities and craft sessions.",true,true
2026-04-24,5080903,1167521,0,THE BIG STORY TRUST,CIO,Registered,2016-06-07,,Submission Received,2024-01-01,2024-12-31,0.0,9809.0,80 Broadview Avenue,Gillingham,,,,ME8 9DE,07917473586,info@thebigstorytrust.org,www.thebigstorytrust.org,,false,false,false,,true,false,,"The Big Story Trust uses the creative arts to proclaim the Good News, equip Christians through training and provide them with resources to tell the Big Story of God.",true,false
2026-04-24,5081143,1167527,0,RCCG SURE FOUNDATION ASSEMBLY,CIO,Registered,2016-06-07,,Submission Received,2023-08-01,2024-07-31,150000.0,150000.0,6 Caudron Way,Hoo,ROCHESTER,Kent,,ME3 9UB,07533765429,,,,false,false,false,,true,false,,advancing the Christian faith,true,false
2026-04-24,5081452,1168465,0,GOOD SHEPHERD TABERNACLE,CIO,Registered,2016-07-27,,Submission Double Default,2020-08-01,2021-07-31,9485.0,8979.0,15 Littlefield Road,Rainham,GILLINGHAM,,,ME8 8SE,07861101496,gshepherdnetwork@gmail.com,www.goodshepherduk.org,,false,false,false,,true,false,,"GOOD SHEPHERD TABERNACLE IS INVOLVED IN VARIOUS WAYS IN SERVING THE LOCAL COMMUNITY. WE OFFER PRACTICAL CHRISTIAN BASED TEACHING AND PASTORAL SUPPORT  TO PEOPLE OF ALL AGE GROUPS, YOUTH AND CHILDREN'S ACTIVITIES, CAP MONEY MANAGEMENT TRAINING, COMMUNITY ACTION AND SUPPORT, HELP FOR THE HOMELESS AND OTHER VULNERABLE PEOPLE AND OVERSEAS AID AND MISSION.",true,false
2026-04-24,5081692,1167791,0,THAMES SEARCH AND RESCUE,CIO,Registered,2016-06-22,,Submission Overdue,2023-06-02,2024-06-01,0.0,0.0,57 MAIDSTONE ROAD,GILLINGHAM,,,,ME8 0DP,07833100000,ThamesSAR@outlook.com,,,false,false,false,,true,false,,Search and Rescue work,false,false
2026-04-24,5082181,1170470,0,STOPSO UK,CIO,Registered,2016-11-30,,Submission Received,2024-04-01,2025-03-31,96271.0,80725.0,PO BOX 831,Rochester,,,,ME1 9SA,07473 299883,info@stopso.org.uk,www.stopso.org.uk,,false,false,false,,true,false,,"StopSO UK is an independent national charity which aims to reduce sexual abuse in the UK. We offer 1-2-1 face to face therapy to those concerned or worried about their sexual thoughts or behaviour before an offence is committed, and to victims and survivors of sexual abuse. Therapy is delivered in communities across the UK.",true,false
2026-04-24,5082587,1167474,0,25TH GILLINGHAM (ST.MARY'S),Other,Registered,2016-06-06,,Submission Received,2024-04-06,2025-04-05,5161.0,6935.0,Castlemaine Ave,gillingham,,,,ME7 2QL,01634579389,25th@gillinghamscouts.org.uk,http://www.gillinghamscouts.org.uk/spage-groups-25th_gillingham.html,,false,false,false,,false,false,,"Scout Group run by volunteers based in Gillingham, Kent",false,true
2026-04-24,5082709,1169554,0,FND ACTION,CIO,Registered,2016-10-10,,Submission Received,2024-01-01,2024-12-31,29054.0,57371.0,5A NEW ROAD AVENUE,CHATHAM,KENT,,,ME4 6BB,07594651566,contact@fndaction.org.uk,www.fndaction.org.uk,,false,false,false,,true,false,,"Raise awareness of Functional Neurological Disorder (FND) and provide information, education, and support across the UK. As a patient-led charity, we work with healthcare professionals, researchers, and associated organisations, develop regional community groups to connect and inform those affected and carers, and lead advocacy to improve understanding, recognition, care pathways and services.",true,false
2026-04-24,5083123,1168598,0,LINE OF DUTY,CIO,Registered,2016-08-03,,Submission Double Default,2020-08-01,2021-07-31,19155.0,16657.0,66 Poplicans Road,Cuxton,ROCHESTER,,,ME2 1EJ,07903041023,,,,false,false,false,,true,false,,"The charity identifies suitably qualified and experienced providers of a range of health care services and therapy and arranges for treatment of the intended beneficiaries, upon checking eligibility, and payment of that treatment via donations from the public.",true,false
2026-04-24,5083968,1169112,0,GILLINGHAM BAPTIST CHURCH,CIO,Registered,2016-09-09,,Submission Received,2024-01-01,2024-12-31,359439.0,188731.0,Gillingham Baptist Church,Green Street,GILLINGHAM,Kent,,ME7 5TJ,01634850369,gbckent19@gmail.com,www.gillinghambaptistchurchkent.org.uk,,false,false,false,,true,false,,"We undertake religious activities in accordance with the Christian Faith, holding services and  mid-week activities for children, young people & adults also providing nurturing & support.We also run a Christian Debt Centre, coffee mornings and a Lunch Club.  Various Community Groups use our premises including people with learning disabilities, cookery classes, Pre School and mental health needs.",true,true
2026-04-24,5084272,1169543,0,BLIGH FUNDRAISING COMMITTEE,Other,Registered,2016-10-10,,Submission Received,2023-09-01,2024-08-31,23639.0,17311.0,Bligh Primary School,Bligh Way,ROCHESTER,Kent,,ME2 2XJ,01634336220,blighfundraising@gmail.com,,,false,false,false,,false,false,,"PTA to Bligh Primary School.Purpose is to advance the education of pupils in the school in particular:- developing effective relationships between staff, parents and other associated with the school- engaging in activities or providing facilities or equipment to support the school and advance the education of pupils.",false,false
2026-04-24,5085374,1169926,0,THE PAROCHIAL CHURCH COUNCIL OF THE ECCLESIASTICAL PARISH OF HIGHAM (ST JOHN THE EVANGELIST) WITH MERSTON,Other,Registered,2016-10-27,,Submission Received,2024-01-01,2024-12-31,109651.0,90499.0,5 Ash Crescent,Higham,ROCHESTER,Kent,,ME3 7BA,01474396569,vicar@highamparishchurch.org.uk,www.highamparishchurch.org.uk,,false,false,false,,false,false,,"Promotion of Christianity and the whole mission of the Church through:TeachingPublic worship open to all.Pastoral work, e.g. visiting sick, bereaved, activities for senior citizens. Assisting local schools by governing, providing facilities for education and worship. Running young persons' and children's groups with a Christian ethos.Supporting other charities in the UK and overseas.",true,true
2026-04-24,5088100,1170482,0,MY SHINING STAR,CIO,Registered,2016-11-30,,Submission Received,2023-12-01,2024-11-30,227259.0,150875.0,9a High Street,Rainham,Kent,,,ME8 7HX,01634362126,enquiries@myshiningstar.co.uk,www.myshiningstar.co.uk,,false,false,false,,true,false,,"Support includes help with debts, food, parking, toys, grants, respite, trauma therapy, bereavement care, sibling support, specialist equipment, clothing, medicine storage, and signposting. We also offer gifts,  extra magic experiences, and campaign for change, therefore easing burdens for families facing childhood cancer.",false,true
2026-04-24,5090460,1171491,0,KINFEST,CIO,Registered,2017-02-06,,Submission Received,2024-04-01,2025-03-31,23591.0,20900.0,30 Castle Street,Upnor,ROCHESTER,Kent,,ME2 4XR,07762317947,info@kinfest.co.uk,www.kinfest.co.uk,,false,false,false,,true,false,,"Kinfest aims to alleviate isoloation within Kinship families.  It does so by organising holidays, events, day trips and fundraising activities for people, and their families, who look after another family or friends child(ren).",false,false
2026-04-24,5090533,1170738,0,VINEYARD OF GLORY MINISTRIES INTERNATIONAL,Charitable company,Registered,2016-12-14,,Submission Received,2023-12-01,2024-11-30,10705.0,11318.0,21 Shottenden Road,GILLINGHAM,,,,ME7 1QX,07903875969,INFO@GIFTAIDSERVICES.CO.UK,INFO@GIFTAIDSERVICES.CO.UK,08303849,false,false,false,,false,false,,ADVANCING THE CHRISTIAN FAITH,false,false
2026-04-24,5090824,1171071,0,CHRISTIAN LIFE FELLOWSHIP - MEDWAY,CIO,Registered,2017-01-10,,Submission Received Late,2024-04-02,2025-04-01,47339.0,40954.0,76 MAPLE AVENUE,GILLINGHAM,,,,ME7 2NT,07957215712,medway@clfi.org,http://hunterdesig9.wixsite.com/clfmedway,,false,false,false,,true,false,,"Community outreach activities including Sunday Church services, Children's Church, Food and Clothes bank, Marriage Seminars, Bible Studies, Homeless outreach and other community activities",false,false
2026-04-24,5091556,1171499,0,"NEW HORIZONS CHILDREN'S ACADEMY PARENTS, TEACHERS AND FRIENDS ASSOCIATION",Other,Registered,2017-02-07,,Submission Received,2024-06-01,2025-05-31,21.0,163.0,NEW HORIZONS CHILDRENS ACADEMY,PARK CRESCENT,CHATHAM,,,ME4 6NR,03333602115,admin@nh-ptfa.org,www.nh-ptfa.org,,false,false,false,,false,false,,"A Charity set up to raise funds for various projects benefitting the pupils and staff of New Horizons Children's Academy,  Chatham, Kent.",false,false
2026-04-24,5093471,1170932,0,ALDRIDGE FOUNDATION CIO,CIO,Registered,2016-12-30,,Submission Received,2023-09-01,2024-08-31,300072.0,543933.0,"2nd floor, Maritime Place",Quayside,Chatham Maritime,Chatham,Kent,ME4 4QZ,02072970365,hello@aldridgefoundation.com,http://www.aldridgefoundation.com,,false,false,false,,true,false,,"The advancement of education through the support of Academies, in particular those which specialise in furthering the entrepreneurial skills of children and young people. The advancement of community development and regeneration, in particular by supporting the development of entrepreneurial and workplace skills. To support such other charitable purposes as the charity trustees see fit.",true,false
2026-04-24,5094650,1172320,0,ST BENEDICT'S CENTRE,Charitable company,Registered,2017-03-29,,Submission Received,2024-01-01,2024-12-31,125097.0,145534.0,DIOCESAN OFFICE,ST. NICHOLAS CHURCH,BOLEY HILL,ROCHESTER,KENT,ME1 1SL,01732252650,bookings@stbenedictscentre.org,https://www.stbenedictscentre.org/,10197485,false,false,false,,false,false,,"The advancement of the Christian faith for the public benefit in particular, but not exclusively, by providing and establishing a training and retreat centre in the area of Malling Abbey for the local community.",true,true
2026-04-24,5094651,1172193,0,FOR YOU UK,CIO,Registered,2017-03-21,,Submission Received Late,2023-07-01,2024-06-30,14329.0,13393.0,324 High Street,ROCHESTER,,,,ME1 1BT,01634789118,info@foryouuk.com,www.foryouuk.com,,false,false,false,,true,false,,"TO PROMOTE SOCIAL INCLUSION FOR THE PUBLIC BENEFIT BY PREVENTING PEOPLE FROM BECOMING SOCIALLY EXCLUDED, RELIEVING THE NEEDS OF THOSE PEOPLE WHO ARE SOCIALLY EXCLUDED AND ASSISTING THEM TO INTEGRATE INTO SOCIETY .",false,true
2026-04-24,5094691,1172065,0,THE MEDWAY LEAGUE OF FRIENDS,CIO,Registered,2017-03-15,,Submission Received,2023-08-01,2024-07-31,1935388.0,1956137.0,Medway Maritime Hospital,Windmill Road,GILLINGHAM,,,ME7 5NY,01634974160,enquiries@medwayleagueoffriends.org.uk,medwayleagueoffriends.org.uk,,false,false,false,,true,false,,"The objects of this Charitable Incorporated Organisation  are the relief of sickness and the promotion of good health and wellbeing of patients of NHS services in Medway.  It began operating on 1 August 2018, taking over from the Unincorporated Charity (Registered Number 240562) which carried out the same function previously.",true,false
2026-04-24,5096778,1176496,0,SHISHU KISHOR CLUB,CIO,Registered,2018-01-03,,Submission Received,2024-04-01,2025-03-31,2566.0,2966.0,6 Milton Road,GILLINGHAM,Kent,,,ME7 5LN,01634328387,,,,false,false,false,,true,false,,"The advancement of Education of people including the teaching of Bengali language and promoting a better understanding of Bengali culture, heritage and history. The promotion of Social Inclusion for the public benefit among women who are socially excluded from society, or parts of society, in particular members of the Bangladeshi community living in Medway, Kent and the surrounding area.",false,false
2026-04-24,5097220,1171970,0,ST JAMES PARENT ASSOCIATION,Other,Registered,2017-03-09,,Submission Received,2023-09-01,2024-08-31,6660.0,12792.0,St James C of E Primary Academy,High Street,Isle of Grain,Rochester,Kent,ME3 0BS,01634270341,stjamesparentsassociation@gmail.com,https://www.stjamesisleofgrain.org.uk/,,false,false,false,,false,false,,"Raise funds through donations, fairs, selling gifts to benefit the children of St James.",false,false
2026-04-24,5097482,1171714,0,VICTORIA PLAYGROUP,CIO,Registered,2017-02-21,,Submission Received,2024-08-01,2025-07-31,46765.0,47625.0,Victoria Pre-School,605 Lords Wood Lane,CHATHAM,,,ME5 8QY,01634683980,victoriapreschool@hotmail.co.uk,,,false,false,false,,true,false,,Victoria Playgroup provides pre-school care and education for up to 11 children a session aged 2-5 years and operates in a small building in Lords wood Chatham Kent,false,false
2026-04-24,5097883,1172240,0,MEDWAY OPEN AWARD CENTRE,CIO,Registered,2017-03-24,,Submission Received,2024-04-01,2025-03-31,49148.0,41176.0,Summit House,Strand Approach Road,GILLINGHAM,,,ME7 1TT,01634 577766,info@moac.co.uk,moac.co.uk,,false,false,false,,true,false,,"Medway Open Award Centre, is a Charitable Interest Organisation set up as a Directly Licenced Centre in which young people can readily access cost effective, knowledge, advice and assistance to facilitate, their achievement of a Duke of Edinburgh's Award at any level. The centre will be staffed by volunteers who believe in the ethos of the Duke of Edinburgh's Award.",false,true
2026-04-24,5100806,1174323,0,THE FRIENDS OF CHATHAM TRACTION,CIO,Registered,2017-08-21,,Submission Received,2024-01-01,2024-12-31,11666.0,6624.0,13 Sealand Court,Esplanade,ROCHESTER,Kent,,ME1 1QH,01634 811014,mesherwendy@gmail.com,www.chathamtraction.org.uk,CE010818,false,false,false,,true,false,,"1) TO PRESERVE, RESTORE, EXHIBIT AND OPERATE FOR PUBLIC BENEFIT THE 1939 BRISTOL K5GDOUBLE-DECK BUS REGISTERED GKE 68: AND(2) TO ADVANCE THE EDUCATION OF THE PUBL IC IN THE HISTORY AND USE OF THEBUS, INCLUDING, BUT NOT LIMITED TO THE HISTORY AND ROLE OF THE CHATHAM A NDDISTRICT TRACTION COMPANY.",true,false
2026-04-24,5100825,1177565,0,MHS HOMES LIMITED,Charitable company,Registered,2018-03-16,,Submission Received,2024-04-01,2025-03-31,83701000.0,73045000.0,M H S HOMES,BROADSIDE,LEVIATHAN WAY,CHATHAM MARITIME,CHATHAM,ME4 4LL,01634354305,contactus@mhs.org.uk,http://www.mhs.org.uk,10704997,false,false,false,,false,false,,"mhs homes is a housing association that helps people, often on lower incomes, who can't afford to buy a home outright. We do this by managing and maintaining our existing homes as well as building new homes.We own and manage about 8,500 homes and have about 20,000 residents. Our homes are in the Medway, Maidstone and Gravesham areas of Kent.",false,true
2026-04-24,5101674,1173762,0,EBEN-EZER INTERNATIONAL CHURCH,Trust,Registered,2017-07-11,,Submission Received,2024-01-01,2024-12-31,24063.0,11670.0,1 CHURCH PATH,INGRAM ROAD,GILLINGHAM,,,ME7 1SJ,07950687572,ebenezerinternationalchurch15@gmail.com,,,false,false,false,,false,false,,Advancement of Christian Faith,true,false
2026-04-24,5103835,1174237,0,THE 1701 SOCIETY,Trust,Registered,2017-08-14,,Submission Received,2024-09-01,2025-08-31,11200.0,13485.0,SIR JOSEPH WILLIAMSONS MATH SCHOOL,MAIDSTONE ROAD,ROCHESTER,,,ME1 3EL,01634844008,,https://1701society.co.uk/,,false,false,false,,false,false,,"The 1701 Society provides support for the educational activities of children at Sir Joseph Williamson's Mathematical School in Rochester. Largely supported by former pupils, as well as current and former parents, it allows those who have an affinity to the school and hold it in high regard to make a regular donation which supports the current pupils at the school.",true,false
2026-04-24,5106674,1174244,0,DENBIGH UNDER FIVES GROUP,CIO,Registered,2017-08-14,,Suppressed,2024-04-01,2025-03-31,163417.0,153283.0,360 INSOLVENCY LIMITED, JOINER'S SHOP,CHATHAM HISTORIC DOCKYARD,CHATHAM HISTORIC DOCKYARD,KENT,ME4 4TZ,01634475546,EMMAWILLOCK@360INSOLVENCY.CO.UK,WWW.360INSOLVENCY.CO.UK,,false,false,false,,true,false,,"Denbigh Under Fives Group is dedicated to childcare that is quality and affordable, welcoming children from two to five years of age as a parent-run charity.  Diversity through language and culture and parent involvement. Teachers (and children) come from different cultures and speak several languages.",true,false
2026-04-24,5106782,1174347,0,INN CHRISTIAN MINISTRIES,CIO,Registered,2017-08-23,,Submission Received,2024-03-01,2025-02-28,10462.0,16817.0,77 Skinner Street,GILLINGHAM,Kent,,,ME7 1LD,07941773627,inncm@inn.org.uk,www.inn.org.uk,,false,false,false,,true,false,,"Advancing Christian faith, furthering Christian and secular education for the public benefit and relieving persons who are in conditions of need or hardship in the United Kingdom and the world",true,false
2026-04-24,5106916,1175531,0,CANCER-EDUCATION,CIO,Registered,2017-11-02,,Submission Received Late,2023-07-29,2024-07-28,0.0,0.0,Kent Space Ltd,6-8 Lordswood Industrial Estate,Revenge Road,CHATHAM,Kent,ME5 8UD,02038118270,info@cancereducationuk.org,www.cancereducationuk.org,,false,false,false,,true,false,,"The charity has three main aims which are:- Educating people from BAMER and low socio economic backgrounds in different boroughs about the signs and symptoms of cancer, different screening programmes available under the NHS.- Supporting patient through their cancer diagnosis and treatment- Lastly, re-integrating patients back into the community and their workplace.",false,false
2026-04-24,5108661,1177323,0,HISTORIC SWALE CIO,CIO,Registered,2018-02-26,,Submission Received,2023-12-01,2024-11-30,520.0,180.0,"Top Floor, 106-110 High Street",Rainham,GILLINGHAM,Kent,,ME8 8AR,07778 793079,chair@historicswale.org.uk,www.historicswale.org.uk,,false,false,false,,true,false,,Historic Swale is an umbrella charity which supports member attractions and organisations in the 3 areas which make up the Swale district to collectively showcase the diverse and fascinating heritage which the Borough offers.,false,false
2026-04-24,5109246,1176816,0,CROSS PARK ASSOCIATION,CIO,Registered,2018-01-24,,Submission Received,2025-01-01,2025-12-31,8355.0,7890.0,Cross Park Pavilion,Avery Way,Allhallows,Rochester,Kent,ME3 9QJ,01634566256,CLERK@ALLHALLOWSKENT-PC.GOV.UK,,,false,false,false,,true,false,,"Operating the Cross Park Pavilion and grounds on an agreement from the Allhallows Parish Council. Organising regular social events for the charity and local third parties. Use of the football pitch by a local team. Access for the public to the site for walking/dog walking. Conservation, improvement and public access to the site.",false,false
2026-04-24,5110184,1177858,0,SQUARE PEGS ARTS,CIO,Registered,2018-04-09,,Submission Received,2024-04-01,2025-03-31,246226.0,293298.0,The Brook Theatre,Old Town Hall,The Brook,Chatham,,ME4 4SE,07944785243,beth@squarepegsarts.com,www.squarepegsarts.com,,false,false,false,,true,false,,"We run drama groups, singing and music projects, a professional Theatre Company, accessible film club and other creative activities for children, young people and adults with learning disabilities and autism in Kent & Medway. We celebrate difference, challenge perceptions and support people to shine in their own way. We nurture friendships, develop confidence, advance skills and improve wellbeing.",true,false
2026-04-24,5110347,1174993,0,HALLING COUNTY PRIMARY SCHOOL PARENT TEACHERS ASSOCIATION,Other,Registered,2017-10-05,,Submission Received,2024-08-01,2025-07-31,18518.0,11819.0,HALLING PRIMARY SCHOOL,HOWLSMERE CLOSE,HALLING,ROCHESTER,,ME2 1ER,01634240258,pta@halling.medway.sch.uk,https://www.halling.medway.sch.uk/,,false,false,false,,false,false,,The Halling Primary School PTA is a charity who aim is to advance the education of pupils in the school. We carry out various fundraising events to provide the necessary funds to purchase required facilities or equipment.,false,false
2026-04-24,5112721,1175822,0,MEDWAY PARK JUDO CLUB,CIO,Registered,2017-11-20,,Submission Received,2024-01-01,2024-12-31,16992.0,14577.0,8 GREENVALE GARDENS,GILLINGHAM,,,,ME8 6HB,07901556470,medwayparkjudo@hotmail.co.uk,www.medwayparkjudoclub.com,,false,false,false,,true,false,,"To further or benefit the residents of Medway, Kent and the surrounding areas by:Promoting community participation in healthy recreation by the provision of coaching and facilities for Judo.Advancing amateur sport by providing coaching and facilities for Judo.",false,true
2026-04-24,5114006,1176111,0,THAMES VIEW PTA,Other,Registered,2017-12-06,,Submission Received Late,2023-08-01,2024-07-31,30210.0,25820.0,Thames View Primary School,Bloors Lane,Rainham,GILLINGHAM,,ME8 7DX,07597545664,thamesviewpta@gmail.com,http://www.thamesviewprimary.medway.sch.uk/,,false,false,false,,false,false,,"The object of the association is to advance the education of pupils in the school in particular by: Developing effective relationships between the staff, parents and others associated with the school; and engaging in activities or providing facilities or equipment which support the school and advance the education of the pupils.",false,false
2026-04-24,5115553,1178702,0,KICC KINGDOM HARVEST,Charitable company,Registered,2018-06-08,,Submission Received,2024-04-01,2025-03-31,90384.0,57568.0,Kingsway International Christian Ce,Maidstone Road,CHATHAM,,,ME5 9QG,07447833298,info@kicckingdomharvest.org.uk,www.kicckingdomharvest.org.uk,11334717,false,false,false,,false,false,,ADVANCEMENT OF THE CHRISTIAN RELIGION.THE FURTHERANCE OF THE CHARITABLE WORK OF THE CHARITY BY THE ADVANCEMENT OF SUCH OTHER CHARITABLE PURPOSES AS THE TRUSTEES SHALL FROM TIME TO TIME DECIDE.,true,false
2026-04-24,5115795,1182959,0,KICC KING'S PRAISE ASSEMBLY,Charitable company,Registered,2019-04-12,,Submission Received,2024-07-01,2025-06-30,0.0,0.0,Kingsway International Christian Ce,Maidstone Road,CHATHAM,,,ME5 9QG,02085250000,admin@KICC.org.uk,www.kicc.org.uk,11421292,false,false,false,,false,false,,The Charity is established for (1) the advancement of the Christian Religion and (2) the furtherance of the charitable work of the Charity by the advancement of such other charitable purposes as the Trustees shall from time to time decide.,false,false
