date_of_extract,organisation_number,registered_charity_number,linked_charity_number,charity_name,charity_type,charity_registration_status,date_of_registration,date_of_removal,charity_reporting_status,latest_acc_fin_period_start_date,latest_acc_fin_period_end_date,latest_income,latest_expenditure,charity_contact_address1,charity_contact_address2,charity_contact_address3,charity_contact_address4,charity_contact_address5,charity_contact_postcode,charity_contact_phone,charity_contact_email,charity_contact_web,charity_company_registration_number,charity_insolvent,charity_in_administration,charity_previously_excepted,charity_is_cdf_or_cif,charity_is_cio,cio_is_dissolved,date_cio_dissolution_notice,charity_activities,charity_gift_aid,charity_has_land
2026-04-24,206812,206812,0,SMEED'S CHARITY,Other,Registered,1962-09-22,,Submission Received,2025-01-01,2025-12-31,486.0,0.0,Kreston Reeves,Montague Place,Quayside,Chatham Maritime,CHATHAM,ME4 4QU,01634899800,,,,false,false,false,,false,false,,Aid for the poor of the parish of Tunstall,false,false
2026-04-24,207100,207100,0,THE WARDENS AND ASSISTANTS OF ROCHESTER BRIDGE IN THE COUNTY OF KENT,Other,Registered,1962-05-30,,Submission Received,2024-04-01,2025-03-31,3858749.0,6639464.0,Rochester Bridge Trust,St. Andrews House,The Precinct,ROCHESTER,Kent,ME1 1SU,01634846706,enquiries@rbt.org.uk,www.rbt.org.uk,,false,false,false,,false,false,,"The maintenance and improvement of two road bridges and a services bridge (known as Rochester Bridge).  Care of and access to archives and historical artefacts. The promotion of other charitable purposes through projects and the award of grants for education and research in engineering, agriculture & history; heritage structures; and charitable purposes connected to the River Medway.",false,true
2026-04-24,209192,209192,0,ROYAL SOCIETY FOR THE PREVENTION OF CRUELTY TO ANIMALS MEDWAY WEST BRANCH,Other,Registered,1962-10-29,,Submission Received,2024-01-01,2024-12-31,159620.0,164323.0,174 Walderslade Road,Chatham,,,,ME5 0PQ,01634681187,reception@rspcamedway.co.uk,www.rspcamedway.co.uk,,false,false,false,,false,false,,"We provide subsidised veterinary treatment for animals owned by local people on low income. We take in and rehome unwanted, abandoned and stray animals.We respond to enquires from the public on a whole range of animal welfare issues. We also provide volunteering opportunities for those who wish to support our work, including trusteeship, fundraising and providing work experience placements.",false,true
2026-04-24,209243,209243,0,PERRIN'S CHARITY,Other,Registered,1962-09-22,,Submission Received,2025-01-01,2025-12-31,221.0,0.0,"Ringshill Farm,",WOULDHAM,ROCHESTER,,,ME1 3TP,07974657788,catherine@ringshillfarm.co.uk,www.PerrinsCharity,,false,false,false,,false,false,,"For the residents of Wouldham near Rochester who:have lived in Wouldham for 10 years or moreare aged 70 years or overare known to be of good characterat the discretion of the Trustees, are known to be in need of financial assistance",false,false
2026-04-24,209751,209751,0,THE LORD KITCHENER MEMORIAL HOMES TRUST,Other,Registered,1962-12-14,,Submission Received,2024-04-01,2025-03-31,41931.0,24014.0,M H S HOMES,BROADSIDE,LEVIATHAN WAY,CHATHAM MARITIME,CHATHAM,ME4 4LL,01634354167,executivesupport@mhs.org.uk,www.mhs.org.uk,,false,false,false,,false,false,,"The purpose of the charity is to provide Almshouse accommodation for people who are in need and who live (or have lived) in the Borough of Medway, with preference given to those who have served in the Armed Forces and their dependents. Furthermore, the objects of the charity are such charitable purposes for the benefit of the residents as the trustee decides.",false,true
2026-04-24,211689,211689,0,WILLIAM ROLFE,Other,Registered,1962-10-10,,Submission Received,2025-01-01,2025-12-31,11106.0,13871.0,12 Villa Road,Higham,Rochester,,,ME3 7BS,01474823423,,,,false,false,false,,false,false,,"TO PROVIDE INCOME TOWARDS DEFRAYING THE COST OF SERVICES FORMERLY PROVIDED BY THE PARISH CLERK IN THE ECCLESIASTICAL PARISH OF SAINT JOHN AND SAINT MARY, HIGHAM, KENT.  IF THE INCOME IS NOT REQUIRED FOR THIS PURPOSE IN ANY YEAR, THEN IT IS USED FOR THE RELIGIOUS AND OTHER CHARITABLE WORK OF THE CHURCH OF ENGLAND IN THE ECCLESIASTICAL PARISH.",false,true
2026-04-24,212360,212360,0,GILLINGHAM UNITED CHARITIES,Other,Registered,1962-12-03,,Submission Received,2024-04-01,2025-03-31,926.0,0.0,MEDWAY COUNCIL,GUN WHARF,DOCK ROAD,CHATHAM,,ME4 4TR,01634332319,robin.baker@medway.gov.uk,,,false,false,false,,false,false,,"The purpose of the charity is to provide assistance to the poor, sick and needy of the ancient parish of Gillingham.",false,false
2026-04-24,212828,212828,0,RICHARD WATTS AND THE CITY OF ROCHESTER ALMSHOUSE CHARITIES,Other,Registered,1962-12-01,,Submission Received,2024-01-01,2024-12-31,1544562.0,1714004.0,The Office,Watts Almshouses,Maidstone Road,Rochester,,ME1 1SE,01634842194,martin.sissons@richardwatts.org.uk,www.richardwatts.org.uk,,false,false,false,,false,false,,Provision of Almshouse accommodation. Grant making to relieve sickness or need to persons resident in the City of Rochester,false,true
2026-04-24,212868,212868,0,ARTHUR INGRAM TRUST,Other,Registered,1962-12-04,,Submission Received,2024-04-01,2025-03-31,88133.0,74067.0,MEDWAY COUNCIL,GUN WHARF,DOCK ROAD,CHATHAM,,ME4 4TR,01634332319,robin.baker@medway.gov.uk,,,false,false,false,,false,false,,"To provide financial assistance towards education/training for young people aged between 14 and 20 years inclusive, who live in the Medway Council area,where they or their parents lack the necessary financial resources.",false,false
2026-04-24,213009,213009,0,DAME D E PEARCE,Other,Registered,1965-06-17,,Submission Overdue,2023-01-01,2023-12-31,0.0,0.0,56 Waterside Lane,Gillingham,,,,ME7 2SE,01634 932135,treasurer@gillinghamparishchurch.org.uk,,,false,false,false,,false,false,,Religious Activities,false,false
2026-04-24,213213,213213,0,"HOSPITAL OF SIR JOHN HAWKINS, KNIGHT, IN CHATHAM",Other,Registered,1963-03-01,,Submission Received,2024-03-01,2025-02-28,67993.0,84662.0,DEPUTY GOVERNOR,HOSPITAL OF SIR JOHN HAWKINS,KNIGHT IN CHATHAM,HIGH STREET,CHATHAM KENT,ME4 4EW ,01474365088,hawkinshospital@yahoo.co.uk,www.hawkinshospital.org,,false,false,false,,false,false,,"Under the Statutory Instrument of 1983 and Scheme Amendment of 1996, the provision of well maintained almshouse accommodation for the relief of needy or disabled persons who have served in the; Royal Navy, Royal Marines, WRNS QARNNS, Royal Fleet Auxiliary, Merchant Navy, Army, Royal Air Force or has been employed in HM Dockyards on the construction, maintenance, refitting or repair of HM Ships.",true,true
2026-04-24,214466,214466,0,FOORD ALMSHOUSES,Other,Registered,1963-11-21,,Submission Received,2024-04-01,2025-03-31,695790.0,726476.0,Foord Almshouses,The Office,Foord Almshouses,Priestfields,Rochester,ME1 3AF,01634844138,office@thefoordalmshouses.co.uk,,,false,false,false,,false,false,,Provision and management of self-contained accommodation for elderly people,false,true
2026-04-24,219318,219318,0,THE FRENCH HOSPITAL,Other,Registered,1964-04-03,,Submission Received,2023-07-01,2024-06-30,721388.0,873340.0,THE FRENCH HOSPITAL,41 La Providence,ROCHESTER,,,ME1 1NB,01634843107,clerk@frenchhospital.org.uk,www.frenchhospital.org.uk,,false,false,false,,false,false,,"THE HOSPITAL MAINTAINS 59 SELF-CONTAINED SHELTERED FLATS WITH ANCILLARY SERVICES AT LA PROVIDENCE, ROCHESTER, KENT.",true,true
2026-04-24,220855,220855,0,CLIFFE AND CLIFFE WOODS COMMUNITY TRUST,Other,Registered,1964-04-14,,Submission Received,2024-04-01,2025-03-31,21307.0,9896.0,52 REED STREET,CLIFFE,ROCHESTER,,,ME3 7UL,01634220422,mrpaulkingman@gmail.com,,CE004165,false,false,false,,false,false,,"Relief of need and educational purposes for residents & parish of Cliffe at Hoo, Rochester, Kent.",false,true
2026-04-24,223737,223737,0,JUBILEE MASTER'S LODGE NO 2712 BENEVOLENT FUND,Trust,Registered,1963-12-31,,Submission Received,2024-01-01,2024-12-31,3441.0,0.0,3 COPSE CLOSE,PATTENS LANE,ROCHESTER,,,ME1 2RS,01634406347,TREASURER@JUBILEEMASTERS.COM,,,false,false,false,,false,false,,General charitable,false,false
2026-04-24,230012,230012,0,THE SAINT PETER'S LODGE BENEVOLENT FUND,Trust,Registered,1964-01-30,,Submission Received,2023-12-01,2024-11-30,10419.0,8987.0,8 St. Johns Close,Higham,ROCHESTER,,,ME3 7BP,07980696850,peter1370@btinternet.com,,,false,false,false,,false,false,,Raffles and collections in the Lodge,false,false
2026-04-24,231532,231532,0,THE ROYAL AIR FORCES ASSOCIATION - MEDWAY TOWNS BRANCH,Other,Registered,1963-12-04,,Submission Received,2024-01-01,2024-12-31,146.0,212.0,20 Goudhurst Road,Gillingham,,,,ME8 6LG,01634543303,,"",,false,false,false,,false,false,,NO INFORMATION RECORDED,false,false
2026-04-24,233519,233519,0,UNITED CHARITIES OF THE ANCIENT PARISH OF BURHAM,Other,Registered,1964-11-18,,Submission Received,2024-01-01,2024-12-31,8022.0,4686.0,17 BELL CRESCENT,BURHAM,ROCHESTER,,,ME1 3SZ,01634867669,david_young17@btinternet.com,,,false,false,false,,false,false,,"Burham United Charities is a charity formed to provide help for the needy and poor living within the ancient parish boundries, now comprising the village of Burham and part of Blue Bell Hill.We offer financial assistance via grants and an annual Winter Fuel Grant to elderly residents in low income households but can also offer one-off assistance in cases of particular need.",false,false
2026-04-24,235248,235248,0,ECCLESIASTICAL MUSIC TRUST,Trust,Registered,1965-03-08,,Submission Received,2024-04-01,2025-03-31,8822.0,7761.0,1 Kings Orchard,ROCHESTER,Kent,,,ME1 1TG,01634812470,gordongiles@gmail.com,,,false,false,false,,false,false,,"Makes grants to individuals (includes loans) and makes grants to organisations (incl. schools, charities etc.)",false,false
2026-04-24,235886,235886,0,THE IRISH GENEALOGICAL RESEARCH SOCIETY,Other,Registered,1964-08-27,,Submission Received,2024-01-01,2024-12-31,21419.0,20869.0,18 STRATFORD AVENUE,GILLINGHAM,,,,ME8 0EP,01634362250,info@irishancestors.ie,http://www.irishancestors.ie/,,false,false,false,,false,false,,"To promote and encourage the study of Irish genealogy and to collect books and manuscripts of genealogical value.Has a library of books and documents relating mainly to Irish Family History, currently in store. Materials can be retrieved upon request by members.Publishes some records relating to Irish Family History on Society's website.For details see the Society's website.",true,false
2026-04-24,237820,237820,0,GILLINGHAM SICK POOR FUND,Other,Registered,1964-11-11,,Submission Received,2024-04-01,2025-03-31,113.0,0.0,MEDWAY COUNCIL,GUN WHARF,DOCK ROAD,CHATHAM,,ME4 4TR,01634332319,robin.baker@medway.gov.uk,,,false,false,false,,false,false,,"The purpose of the charity is to provide assistance to the poor, sick and needy of the ancient parish of Gillingham.",false,false
2026-04-24,237821,237821,0,THE ROCHESTER VETERANS CLUB,Trust,Registered,1966-01-03,,Submission Received,2024-04-07,2025-04-06,7540.0,7125.0,29 Robin Hood Lane,CHATHAM,Kent,,,ME5 9NS,01634 668649,david.brake@hotmail.co.uk,,,false,false,false,,false,false,,To provide sport and recreational facilities for the elderly and old people living in and around the Medway area using facilities which are fully maintained for the stated purpose.,false,false
2026-04-24,239570,239570,0,CHARITY OF JAMES WATSON RANDALL,Other,Registered,1965-01-25,,Submission Received,2025-01-01,2025-12-31,218.0,0.0,Emmaus Christian Centre,Clover Street,Chatham,Kent,,ME4 4DT,01634811632,admin@emmauschatham.co.uk,www.emmauschatham.co.uk,,false,false,false,,false,false,,"Charitable donations to needy individuals, good causes, and charity supported organisations",false,false
2026-04-24,242004,242004,0,CHARITY OF MISS MARY GOORD,Other,Registered,1965-05-26,,Submission Received,2024-01-01,2024-12-31,126.0,2500.0,HAVERSHAM HOUSE,DICKENSIAN CLOSE,UPPER STOKE,ROCHESTER,KENT,ME3 9TB,01634270026,bett9jg@btinternet.com,stpeterstpaulupperstoke.uk,,false,false,false,,false,false,,to help elderly    people in need in the parish,false,false
2026-04-24,245480,245480,0,MEDWAY SOCIETY OF CLUBS FOR THE PHYSICALLY HANDICAPPED,Other,Registered,1966-11-11,,Submission Received,2024-03-01,2025-02-28,8625.0,7469.0,MSCH Hall,The Strand,GILLINGHAM,,Kent,ME7 1TT,07842088646,MSCHCHARITY@gmail.com,,,false,false,false,,false,false,,Provide sports and social facilities for disabled members of the Medway Towns and surrounding areas.,false,true
2026-04-24,246906,246906,0,CHARITY OF THOMAS STEVENS,Other,Registered,1966-02-22,,Submission Received,2024-04-01,2025-03-31,757.0,1260.0,196-198 Bush Road,Cuxton,ROCHESTER,Kent,,ME2 1HE,01634716334,iangray@live.co.uk,,,false,false,false,,false,false,,"Thomas Stevens, a gentleman farmer, owner of Parsonage Farm, Cobham died 1893 and the charity was founded under the provision of his will. A charitable trust bequeathed to the parish of Cuxton, Kent, for those who deserve benefit. Originally set up to provide bread or coals for the poor; now interpreted as food or fuel. Beneficiaries must live within Cuxton civil parish for the minimum of 2 years.",false,false
2026-04-24,249339,249339,0,THE ROCHESTER DIOCESAN SOCIETY AND BOARD OF FINANCE,Charitable company,Registered,1966-09-26,,Submission Received,2024-01-01,2024-12-31,12655460.0,14449693.0,ROCHESTER DIOCESAN SOCIETY &amp; BOARD,OF FINANCE,ST. NICHOLAS CHURCH,BOLEY HILL,ROCHESTER,ME1 1SL,01634560000,enquiries@rochester.anglican.org,www.rochester.anglican.org,00140656,false,false,false,,false,false,,"ADMINISTRATIVE SUPPORT FOR THE CHURCH OF ENGLAND IN THE AREAS OF WEST KENT AND SOUTH EAST LONDON, WITH SUPPORT BEING GIVEN TO PARISHES, PEOPLE AND ORGANISATIONS IN THOSE AREAS",true,true
2026-04-24,249692,249692,0,THE GARTH DOUBLEDAY TRUST,Trust,Registered,1966-10-11,,Submission Received,2024-04-06,2025-04-05,114582.0,13582.0,2nd Floor,Maritime Place,"Quayside,Chatham Maritime",CHATHAM,Kent,ME4 4QZ,01634899800,,,,false,false,false,,false,false,,Provision of grants to charities and charitable purposes,false,false
2026-04-24,252603,252603,0,THE CITY OF ROCHESTER SOCIETY,Other,Registered,1967-06-23,,Submission Received,2024-01-01,2024-12-31,12115.0,18491.0,42 Academy Drive,GILLINGHAM,,,,ME7 3EJ,01634854683,info@city-of-rochester.org.uk,www.city-of-rochester.org.uk,,false,false,false,,false,false,,"The Society's area of interest is the pre-1974 city boundaries of Rochester including urban Strood.The Society's activities cover guided tours of Rochester, publication of leaflets/books on the City's history and making representation on relevant planning applications to Medway Council.The Society is represented on many bodies in the area covering tourism, built environment and conservation.",false,false
2026-04-24,252744,252744,0,HEMPSTEAD VILLAGE HALL MANAGEMENT COMMITTEE,Other,Registered,1967-12-18,,Submission Received,2024-04-01,2025-03-31,37562.0,50113.0,Hempstead Village Hall,169 Hempstead Road,Hempstead,GILLINGHAM,,ME7 3QG,07941 573713,hempsteadvillagehall@outlook.com,hempsteadvillagehall.com,,false,false,false,,false,false,,The Hall provides space and facilities for community services and activities.,false,false
2026-04-24,253877,253877,0,ROCHESTER CHORAL SOCIETY,Other,Registered,1967-10-04,,Submission Received,2023-08-01,2024-07-31,41901.0,38584.0,18 Watts Avenue,ROCHESTER,Kent,,,ME1 1RX,07968452047,rochesterchoral@gmail.com,www.rochesterchoral.co.uk,,false,false,false,,false,false,,"To promote, improve, develop and maintain public education in and appreciation of the art and science of music in all its aspects by:a) providing opportunities for members of the Medway and local communities to enjoy choral   music through participation and involvementb) the performance of public concerts and recitals and by such other means as the Society through its Committee shall determine",true,false
2026-04-24,254140,254140,0,RAPPORT HOUSING AND CARE,Charitable company,Registered,1967-12-06,,Suppressed,2020-10-01,2021-09-30,16663618.0,16828419.0,Rapport Housing & Care,The Old Wharf,Station Road,Cuxton,ROCHESTER,ME2 1AB,01634723007,enquiry@rapporthc.co.uk,www.rapporthousingandcare.co.uk,00908333,true,false,false,,false,false,,"The organisation exists to establish, manage and improve houses and homes which provide residential and supported accommodation, together with care and companionship, for elderly people.",true,true
2026-04-24,254358,254358,0,ROYAL ANTEDILUVIAN ORDER OF BUFFALOES G L E KENT COUNTY PROVINCIAL GRAND LODGE BENEVOLENT FUND,Trust,Registered,1967-12-18,,Submission Received,2024-01-01,2024-12-31,3.0,250.0,29 Waltham Road,GILLINGHAM,Kent,,,ME8 6XE,01634 353163,kentcountypgl@gmail.com,"",,false,false,false,,false,false,,Philanthropic help for members and their families together with donations to outside charitites,false,false
2026-04-24,258275,258275,0,CHURCH ESTATE,Other,Registered,1969-04-29,,Submission Received,2024-01-01,2024-12-31,17206.0,16189.0,St. Margarets Millennium Centre,Gatekeeper Chase,Rainham,GILLINGHAM,Kent,ME8 9BH,01634230183,vicar@rainhamchurch.co.uk,,,false,false,false,,false,false,,"Specifically for the upkeep, repair & maintenance of St Margaret's Church Rainham and its churchyard.",false,false
2026-04-24,258322,258322,0,ROYAL ENGINEERS ASSOCIATION,Other,Registered,1969-06-03,,Submission Received,2024-01-01,2024-12-31,1437036.0,1966681.0,The Royal Engineers Association,Ravelin Building,Brompton Barracks,Chatham,Kent,ME4 4UG ,01634847005,ken.kirk@reahq.org.uk,www.reahq.org.uk,,false,false,false,,false,false,,"To provide financial and other assistance to serving and former members of the Corps, their spouses, widows, widowers and dependants who are in need through poverty.  To make grants, within Association Guidelines, to the Army Benevolent Fund and to other charities that further the objectives of the Association.",false,true
2026-04-24,259740,259740,0,THE MEDWAY TOWNS GURUDWARA SABHA LIMITED,Charitable company,Registered,1970-09-22,,Submission Received,2024-01-01,2024-12-31,516691.0,396943.0,Medways Town Gurdwara Sabah,1-5 Lankester Parker Road,ROCHESTER,Kent,,ME1 3QU,01634270392,,,00894740,false,false,false,,false,false,,PROMOTE SIKHISM,true,false
2026-04-24,262179,262179,0,BURHAM WAR MEMORIAL,Other,Registered,1971-03-12,,Submission Received,2024-04-01,2025-03-31,0.0,65.0,Burham Parish Council,Rochester Road,Burham,ROCHESTER,,ME1 3RJ,01634685936,pam@burhampc.co.uk,www.burhampc.kentparishes.gov.uk,,false,false,false,,false,false,,lOOKS AFTER THE WAR MEMORIAL AND FENCING AND GATES,false,false
2026-04-24,262302,262302,0,THE ROTARY CLUB OF CHATHAM SERVICE FUND,Trust,Registered,1971-04-08,,Submission Received,2024-07-01,2025-06-30,1349.0,1394.0,9 Haredale Close,ROCHESTER,Kent,,,ME1 2DN,01634843958,Leonie.Rotary@outlook.com,www.chathamrotary.org.uk,,false,false,false,,false,false,,Within the framework of Rotary International:General Charitable PurposesRelief of PovertyOverseas aid/Famine reliefto: Children/Young peopleElderly/Old PeoplePeople with disabilitiesOther charities/Voluntary bodiesGeneral public/Mankind,true,false
2026-04-24,262487,262487,0,MEDWAY HINDU PARIVAR,Other,Registered,1971-06-14,,Submission Received,2024-01-01,2024-12-31,19793.0,19793.0,69 The Everglades,Hempstead,GILLINGHAM,Kent,,ME7 3PZ,07845077177,presidentmedwayhinduparivar@gmail.com,,,false,false,false,,false,false,,"We hold religious, social and cultural functions and collective Hindu worship. Our youth wing learns and exhibits folk and cultural dances/songs at our events and is a very active group. We run a senior citizens' group that meets once a week and engages in physical, social, cultural and religious activities.",false,false
2026-04-24,264018,264018,0,THE ST MICHAEL LE QUERNE LODGE (FREEMASONS) BENEVOLENT FUND,Other,Registered,1972-08-01,,Submission Received,2024-04-01,2025-03-31,0.0,0.0,19 Park Crescent,CHATHAM,,,,ME4 6NR ,01634405945,alansmart.aes@gmail.com,,,false,false,false,,false,false,,TO ASSIST MASONS AND THEIR FAMILIES IN TIMES HARDSHIP OR DISTRESS,false,false
2026-04-24,264432,264432,0,THE SAMARITAN FUND,Other,Registered,1972-08-23,,Submission Received,2024-01-01,2024-12-31,20166.0,15751.0,Regtl Headquarters Royal Engineers,Brompton Barracks,Chatham,,Kent,ME4 4UG,07539 009741 ,secretary@reows.co.uk,www.reows.co.uk,,false,false,false,,false,false,,Gives financial support to the widow(er)s and/or dependants of deceased Royal Engineer Officers.,true,false
2026-04-24,264844,264844,0,CITY OF ROCHESTER SYMPHONY ORCHESTRA,Other,Registered,1972-11-20,,Submission Received,2023-08-01,2024-07-31,23165.0,31544.0,2 DE MERE CLOSE,GILLINGHAM,,,,ME8 9JY,01634378299,info@crso.org.uk,www.crso.org.uk,,false,false,false,,false,false,,"A local orchestra for local players and audience membersEncourage people in the South East to play live orchestral musicEncourage people in South East to take full advantage of the opportunity to hear live orchestral music, played to a high standard Provide cultural activity that strives for excellence and develops confidence and pride for players, the audience and the South East region.",true,false
2026-04-24,265953,265953,0,ALLHALLOWS VILLAGE HALL,Trust,Registered,1973-09-17,,Submission Received,2024-01-01,2024-12-31,9786.0,14544.0,25 Binney Road,Allhallows,ROCHESTER,Kent,,ME3 9QP,07764 610029 ,allhallowsvillagehall70@gmail.com,,,false,false,false,,false,false,,"Social functions for community, pre school, bingo, quiz nights, indoor bowling, dancing instruction and weddings, birthday parties, etc",false,true
2026-04-24,269935,269935,0,BURHAM VILLAGE HALL,Other,Registered,1975-09-17,,Submission Received,2023-10-01,2024-09-30,21950.0,22389.0,17 BELL CRESCENT,BURHAM,ROCHESTER,,,ME1 3SZ,01634867669,,,,false,false,false,,false,false,,"To manage the day to day running of Burham Village Hall, on behalf of the residents of the village of Burham.",false,true
2026-04-24,270221,270221,0,12th and 17th Medway Towns Scout Group,Other,Registered,1975-11-05,,Submission Received,2024-04-01,2025-03-31,25635.0,18417.0,12th and 17th Medway Scout Hut,Capstone Road,Chatham,Kent,,ME5 7PL,07738626073,trustee@12th17thmedwaytowns.org.uk,https://www.12th17thmedwaytowns.org.uk,,false,false,false,,false,false,,"THE AIM OF THE SCOUT ASSOCIATION IS TO PROMOTE THE DEVELOPMENT OF YOUNG PEOPLE.BY PROVIDING A BALANCED PROGRAMME OF ACTIVITIES THAT PROVIDE FUN, LEARNING AND SUPPORTING THE LOCAL COMMUNITY. WE SEEK TO ACHIEVE THIS BY USING THE BALANCED TRAINING PROGRAMME SCHEME.",false,true
2026-04-24,270790,270790,0,PARKWOOD COMMUNITY ASSOCIATION,Other,Registered,1976-03-29,,Submission Received,2024-01-01,2024-12-31,366319.0,410241.0,PARKWOOD COMMUNITY CENTRE,PARKWOOD GREEN,GILLINGHAM,,,ME8 9PN,01634371886,INFO@PWCA-RAINHAM.ORG,www.pwca-rainham.org,,false,false,false,,false,false,,"PWCA is primariliy set up to provide Social Welfare & Education activities within the Parkwood Area. This includes a number of activities such as; Pre-School Nursery, Dancing Classes, Keep Fit, Slimming Classes and a number of internal groups (such as Camera, Organ, Radio enthusiasts groups).",false,true
2026-04-24,271371,271371,0,THE DUROBRIVAE LODGE BENEVOLENT FUND,Other,Registered,1976-05-26,,Submission Received,2024-04-01,2025-03-31,77445.0,67146.0,87 Valley View Road,ROCHESTER,Kent,,,ME1 3NX,01634323991,Jeremy@jbindustrialdoors.co.uk,,,false,false,false,,false,false,,"As a Masonic Lodge we collect via members and visitors donations from a variety of ways (raffles,alms,box and envelopes) which we then donate to charitable causes either masonic charities and non masonic charities.The masonic hall is let to various masonic groups as well as non masonic groups",false,true
2026-04-24,273123,273123,0,MEDWAY AREA SUNDAY FOOTBALL LEAGUE BENEVOLENT FUND,Other,Registered,1977-03-25,,Submission Received,2024-01-01,2024-12-31,8.0,0.0,M C Associates Ltd,80c Asquith Road,Gillingham,,,ME8 0JB,01634230151,ENRIGHT.PETER@SKY.COM,www.mmsfl.co.uk,,false,false,false,,false,false,,To help those involved in local football in the Medway area.,false,false
2026-04-24,273392,273392,0,THE ST PETER-UPON-CORNHILL TRUST,Other,Registered,1977-04-24,,Submission Received,2024-01-01,2024-12-31,1400.0,0.0,47 St. Margarets Street,Rochester,,,,ME1 1UF,02075663816,,stpeteruponcornhill.org.uk,,false,false,false,,false,false,,Financial support for St Peter-upon-Cornhill and associated Christian ministries,true,false
2026-04-24,273489,273489,0,THE VALERIE WHITE MEMORIAL TRUST,Trust,Registered,1977-06-27,,Submission Received,2024-04-06,2025-04-05,43863.0,22980.0,Second Floor South,The Fitted Rigging House,Anchor Wharf,The Historic Dockyard,Chatham Kent,ME4 4TZ,01474569032,info@carley.co.uk,,,false,false,false,,false,false,,Grant making to animal trusts and drama students.,false,false
2026-04-24,273596,273596,0,LIVE MUSIC NOW LIMITED,Charitable company,Registered,1977-05-25,,Submission Received,2024-04-01,2025-03-31,1362782.0,1399431.0,Live Music Now,337-341 High Street,ROCHESTER,Kent,,ME1 1DA,020 7759 1803,info@livemusicnow.org.uk,www.livemusicnow.org.uk,01312283,false,false,false,,false,false,,"Live Music Now is a UK-wide music outreach charity, established in 1977 by Yehudi Menuhin with two strategic aims;  To bring live music of the highest quality to those for whom access to its benefits is normally restricted; To support the professional development of musicians at the outset of their careers, ensuring the highest quality of delivery through a rigorous selection and training process.",true,false
